{
  "$schema": "../../../schema/miniapp.schema.json",
  "slug": "skillsnack",
  "title": "SkillSnack",
  "subtitle": "5-minute skill boosts.",
  "category": "Education",
  "keywords": [
    "learning",
    "micro",
    "education"
  ],
  "isFeatured": false,
  "ageBand": {
    "min": 13,
    "max": null
  },
  "universalLink": "https://miniapps.studio/skillsnack",
  "asset": {
    "bundleSubdirectory": "apps/education/skillsnack",
    "entrypoint": "index"
  },
  "skuIds": [],
  "previewImageName": null
}
