{
  "$schema": "../../../schema/miniapp.schema.json",
  "slug": "inboxzen",
  "title": "InboxZen",
  "subtitle": "Triage email in seconds.",
  "category": "Productivity",
  "keywords": [
    "email",
    "productivity",
    "triage"
  ],
  "isFeatured": true,
  "ageBand": {
    "min": 13,
    "max": null
  },
  "universalLink": "https://miniapps.studio/inboxzen",
  "asset": {
    "bundleSubdirectory": "apps/productivity/inboxzen",
    "entrypoint": "index"
  },
  "skuIds": [],
  "previewImageName": null
}
