{
  "$schema": "../../../schema/miniapp.schema.json",
  "slug": "languageloop",
  "title": "LanguageLoop",
  "subtitle": "Roleplay loops on demand.",
  "category": "Education",
  "keywords": [
    "language",
    "practice",
    "phrases"
  ],
  "isFeatured": false,
  "ageBand": {
    "min": 13,
    "max": null
  },
  "universalLink": "https://miniapps.studio/languageloop",
  "asset": {
    "bundleSubdirectory": "apps/education/languageloop",
    "entrypoint": "index"
  },
  "skuIds": [],
  "previewImageName": null
}
