{
  "$schema": "../../../schema/miniapp.schema.json",
  "slug": "billbreeze",
  "title": "BillBreeze",
  "subtitle": "Cash-flow clarity in minutes.",
  "category": "Finance",
  "keywords": [
    "budget",
    "cashflow",
    "bills"
  ],
  "isFeatured": true,
  "ageBand": {
    "min": 13,
    "max": null
  },
  "universalLink": "https://miniapps.studio/billbreeze",
  "asset": {
    "bundleSubdirectory": "apps/finance/billbreeze",
    "entrypoint": "index"
  },
  "skuIds": [
    "com.studiob.billbreeze.plus"
  ],
  "previewImageName": null
}
