{
  "$schema": "../../../schema/miniapp.schema.json",
  "slug": "pocketporter",
  "title": "PocketPorter",
  "subtitle": "AI packing buddy",
  "category": "Travel",
  "keywords": [
    "packing",
    "travel",
    "carry-on",
    "checklist"
  ],
  "isFeatured": true,
  "ageBand": {
    "min": 4,
    "max": null
  },
  "universalLink": "https://miniapps.studio/pocketporter",
  "asset": {
    "bundleSubdirectory": "apps/travel/pocketporter",
    "entrypoint": "index"
  },
  "skuIds": [],
  "previewImageName": null
}
