{
  "$schema": "../../../schema/miniapp.schema.json",
  "slug": "meetingminder",
  "title": "MeetingMinder",
  "subtitle": "Prep + follow-up in one swipe.",
  "category": "Productivity",
  "keywords": [
    "meeting",
    "agenda",
    "productivity"
  ],
  "isFeatured": false,
  "ageBand": {
    "min": 13,
    "max": null
  },
  "universalLink": "https://miniapps.studio/meetingminder",
  "asset": {
    "bundleSubdirectory": "apps/productivity/meetingminder",
    "entrypoint": "index"
  },
  "skuIds": [],
  "previewImageName": null
}
