{
  "$schema": "../../../schema/miniapp.schema.json",
  "slug": "tiptally",
  "title": "TipTally",
  "subtitle": "Instant tip + split notes.",
  "category": "Finance",
  "keywords": [
    "tip",
    "split",
    "calculator"
  ],
  "isFeatured": false,
  "ageBand": {
    "min": 13,
    "max": null
  },
  "universalLink": "https://miniapps.studio/tiptally",
  "asset": {
    "bundleSubdirectory": "apps/finance/tiptally",
    "entrypoint": "index"
  },
  "skuIds": [],
  "previewImageName": null
}
